question,label
Quiz me on Nietzsche.,quiz
Quiz me on filosofia.,quiz
I want to be tested on Nietzsche.,quiz
Ask something about Kant.,quiz
I want a quiz on Schopenhauer.,quiz
Ask something about Marx.,quiz
Test me on filosofia del Rinascimento?,quiz
I want to be tested on filosofia.,quiz
I want a quiz on filosofia della scienza?,quiz
Test me on illuminismo.,quiz
Ask a verification question on Locke.,quiz
I want to be tested on Hume.,quiz
Test me on epicureismo.,quiz
Test me on nichilismo.,quiz
I want to be tested on Heidegger.,quiz
Ask something about Aristotele.,quiz
I want to be tested on Spinoza.,quiz
Ask a verification question on Spinoza.,quiz
Create a quiz on Nietzsche.,quiz
Create a quiz on Wittgenstein.,quiz
I want to be tested on Platone.,quiz
Quiz me on Marx.,quiz
Test me on Descartes.,quiz
Ask me a question about Socrate.,quiz
Create a quiz on filosofia.,quiz
Ask a verification question on Kant.,quiz
Test me on pragmatismo.,quiz
I want to be tested on Marx.,quiz
Create a quiz on Hegel.,quiz
Quiz me on Descartes.,quiz
Test me on filosofia.,quiz
Ask something about Rousseau.,quiz
Ask something about Platone.,quiz
Test me on Locke.,quiz
Make a quiz on gnoseologia moderna.,quiz
Make a quiz on dialettica hegeliana.,quiz
Test me on Kant.,quiz
Ask a verification question on Rousseau.,quiz
Ask a verification question on Cartesio.,quiz
Ask a verification question on Aristotele.,quiz
I want a quiz on filosofia contemporanea?,quiz
Ask a verification question on Nietzsche.,quiz
I want a quiz on filosofia di Kant?,quiz
Quiz me on Platone.,quiz
Test me on empirismo inglese.,quiz
Ask something about filosofia.,quiz
Fai un quiz sul marxismo.,quiz
Make a quiz on filosofia del linguaggio.,quiz
Ask something about Nietzsche.,quiz
Ask a question about Rousseau.,quiz
Ask a verification question on Wittgenstein.,quiz
Test me on idealismo tedesco.,quiz
Test me on esistenzialismo.,quiz
Make a quiz on metafisica aristotelica.,quiz
Create a quiz on Kant.,quiz
Test me on Platone.,quiz
I want to be tested on Locke.,quiz
Ask a verification question on Marx.,quiz
Test me on Marx.,quiz
Ask something about Hume.,quiz
I want a quiz on 'etica aristotelica?,quiz
I want a quiz on critica della ragion pura?,quiz
Quiz me on Kant.,quiz
Test me on o stoicismo?,quiz
Create a quiz on Hume.,quiz
Test me on Rousseau.,quiz
Test me on Hegel.,quiz
Test me on filosofia medievale?,quiz
What è la differenza tra Marx e Hegel?,confronto
What è la differenza tra libertà negativa e libertà positiva?,confronto
What è la differenza tra il bene in Platone e in Aristotele?,confronto
How do differ Platone e Hegel?,confronto
Come si confrontano utopia di Platone e utopia di More?,confronto
What è la differenza tra il materialismo di Marx e quello di Epicuro?,confronto
Metti a confronto Hegel e Sartre.,confronto
In cosa differisce il contratto sociale di Rousseau da quello di Hobbes?,confronto
How does differ il pensiero di Heidegger da quello di Husserl?,confronto
How do differ Platone da Hegel?,confronto
Metti a confronto Descartes e Spinoza.,confronto
How do differ Descartes e Spinoza?,confronto
What è la differenza tra dialettica platonica e dialettica hegeliana?,confronto
What è la differenza tra monismo e dualismo?,confronto
Metti a confronto Marx e Hegel.,confronto
Come si confrontano le visioni politiche di Hobbes e Locke?,confronto
How does differ la visione della natura in Rousseau e Hobbes?,confronto
How do differ razionalismo ed empirismo?,confronto
What è la differenza tra Platone e Aristotele?,confronto
How do contrast Hobbes e Locke?,confronto
How do contrast Aristotele e Kant?,confronto
Quali sono le differenze tra etica kantiana e utilitarismo?,confronto
Quali sono le similarità e differenze tra Aristotele e Kant?,confronto
Come si confrontano Kant e Hume sul concetto di causalità?,confronto
How do differ Platone e Aristotele?,confronto
Quali sono le similarità e differenze tra Platone e Nietzsche?,confronto
Metti a confronto Aristotele e Kant.,confronto
How do contrast Descartes e Spinoza?,confronto
Come si distingue il pensiero di Locke da quello di Berkeley?,confronto
Come si confrontano Platone e Nietzsche sul tema della verità?,confronto
Come si confrontano Freud e Nietzsche sull'inconscio?,confronto
How does differ la concezione di Dio in Cartesio e Spinoza?,confronto
In cosa si confrontano Socrate e i Presocratici sul tema della conoscenza?,confronto
How do contrast Platone e Aristotele?,confronto
In cosa differisce il nichilismo di Nietzsche dallo scetticismo antico?,confronto
Metti a confronto Kant e Hume.,confronto
Come si distingue la logica aristotelica da quella moderna?,confronto
How do contrast Hegel e Sartre?,confronto
What è la differenza tra Rousseau e Hobbes?,confronto
What è la differenza tra ontologia e metafisica?,confronto
Quali sono le similarità e differenze tra Kant e Spinoza?,confronto
What è la differenza tra stoicismo ed epicureismo?,confronto
What è la differenza tra il bello in Kant e in Platone?,confronto
Metti a confronto Platone e Kant.,confronto
Come si confrontano Marx e Hegel sul concetto di storia?,confronto
Come si confrontano Agostino e Tommaso d'Aquino sulla ragione?,confronto
How does differ Socrate dai Sofisti?,confronto
In cosa differisce la visione del tempo in Kant e in Bergson?,confronto
Come si distingue il realismo di Aristotele dall'idealismo di Platone?,confronto
How does differ il pragmatismo americano dalla fenomenologia europea?,confronto
Metti a confronto Hobbes e Locke.,confronto
Quali sono le similarità e differenze tra Rousseau e Hobbes?,confronto
What è la differenza tra Platone e Hegel?,confronto
What è la differenza tra esistenzialismo e fenomenologia?,confronto
How do contrast Platone e Nietzsche?,confronto
Come si confrontano Aristotele e Kant sull'etica?,confronto
How do differ Hegel da Sartre?,confronto
How do differ Platone da Kant?,confronto
Metti a confronto Rousseau e Hobbes.,confronto
What è la differenza tra etica deontologica ed etica consequenzialista?,confronto
Quali sono le similarità e differenze tra Descartes e Spinoza?,confronto
What è la differenza tra Aristotele e Kant?,confronto
Come si applica il metodo maieutico in una conversazione reale?,esempio
Puoi fare un esempio di il contratto sociale?,esempio
Come si manifesta la volontà di potenza in un esempio concreto?,esempio
Dammi un esempio concreto di Locke.,esempio
Puoi farmi un esempio concreto di imperativo categorico nella vita quotidiana?,esempio
Come si applica la logica formale aristotelica in un argomento?,esempio
Come si applica il contratto sociale?,esempio
Dammi un esempio concreto di Kant.,esempio
Puoi fare un esempio di Sartre?,esempio
Come si manifesta il relativismo culturale in una pratica sociale?,esempio
Come si manifesta filosofia nella vita reale?,esempio
Puoi fare un esempio di ragionamento induttivo e deduttivo?,esempio
Illustra Aristotele con un esempio.,esempio
Come si applica la giustizia distributiva di Aristotele in una società?,esempio
Illustra Sartre con un esempio.,esempio
Puoi fare un esempio del velo dell'ignoranza di Rawls?,esempio
Come si manifesta l'angoscia esistenziale secondo Kierkegaard?,esempio
Puoi fare un esempio di aporia socratica in una discussione?,esempio
Come si manifesta il nichilismo nella cultura contemporanea?,esempio
Puoi darmi un esempio di epoché fenomenologica?,esempio
Puoi darmi un esempio di amor fati nella vita di una persona?,esempio
Fai un caso pratico di imperativo categorico.,esempio
Come si manifesta la dialettica tesi-antitesi-sintesi in un evento storico?,esempio
Come si applica Kant?,esempio
Illustra Hegel con un esempio.,esempio
Fai un caso pratico di filosofia.,esempio
Come si manifesta Hegel nella vita reale?,esempio
Fai un caso pratico di Hegel.,esempio
Puoi darmi un esempio di pensiero utopico nella storia?,esempio
Illustra Locke con un esempio.,esempio
Puoi fare un esempio di Hegel?,esempio
Dammi un esempio concreto di il contratto sociale.,esempio
Puoi fare un esempio di Kant?,esempio
Puoi darmi un esempio del paradosso dello scetticismo?,esempio
Come si applica il contratto sociale nella democrazia moderna?,esempio
Come si manifesta l'etica della cura in una relazione?,esempio
Come si manifesta volontà di potenza nella vita reale?,esempio
Puoi fare un esempio di atto libero secondo Sartre?,esempio
Fai un caso pratico di il contratto sociale.,esempio
Puoi fare un esempio di giudizio sintetico a priori secondo Kant?,esempio
Come si applica la teoria delle idee di Platone all'arte?,esempio
Come si applica il principio di utilità di Bentham in una legge?,esempio
Come si applica filosofia?,esempio
Puoi darmi un esempio di alienazione nel mondo del lavoro?,esempio
Come si applica Hegel?,esempio
Puoi fare un esempio di Locke?,esempio
Come si manifesta il dualismo mente-corpo in un esempio pratico?,esempio
Come si applica Locke?,esempio
Puoi fare un esempio di pensiero dialettico hegeliano?,esempio
Dammi un esempio concreto di il mito della caverna.,esempio
Come si applica il principio di non contraddizione in una discussione?,esempio
Puoi darmi un esempio di morale stoica di fronte alla sofferenza?,esempio
Dammi un esempio concreto di Sartre.,esempio
Illustra imperativo categorico con un esempio.,esempio
Puoi darmi un esempio di determinismo nella fisica classica?,esempio
Illustra il mito della caverna con un esempio.,esempio
Come si applica Sartre?,esempio
Puoi darmi un esempio del mito della caverna nella società moderna?,esempio
Come si applica il cogito cartesiano nel ragionamento filosofico?,esempio
Illustra il contratto sociale con un esempio.,esempio
Puoi fare un esempio di volontà di potenza?,esempio
Illustra Platone con un esempio.,esempio
Dammi un esempio concreto di filosofia.,esempio
Dammi un esempio concreto di Aristotele.,esempio
Quali sono gli aspetti principali di filosofia?,approfondimento
Quali sono gli aspetti principali di Marx?,approfondimento
Come si sviluppa la critica all'illuminismo in Adorno e Horkheimer?,approfondimento
Approfondisci il tema della solidarietà in Rorty.,approfondimento
Approfondisci il concetto di Übermensch in Nietzsche.,approfondimento
Sviluppa il concetto di Hegel.,approfondimento
Approfondisci la teoria della conoscenza di Hume.,approfondimento
Quali sono gli aspetti principali di Wittgenstein?,approfondimento
Come evolve la concezione dell'inconscio da Nietzsche a Freud?,approfondimento
Come si sviluppa il pensiero ecologico nella filosofia contemporanea?,approfondimento
Approfondisci il tema del riconoscimento in Hegel e Honneth.,approfondimento
Approfondisci il concetto di responsabilità in Jonas.,approfondimento
Come evolve la concezione della democrazia da Rousseau a Habermas?,approfondimento
Come si sviluppa il pensiero di Simone de Beauvoir sul femminismo?,approfondimento
Approfondisci il ruolo della ragione nella filosofia illuminista.,approfondimento
Come evolve il concetto di libertà nel pensiero moderno?,approfondimento
Approfondisci il tema di Hegel.,approfondimento
Come evolve la filosofia della mente nel pensiero contemporaneo?,approfondimento
Approfondisci il tema di Wittgenstein.,approfondimento
Approfondisci il concetto di coscienza in Hegel.,approfondimento
Analizza in dettaglio Platone.,approfondimento
Come si sviluppa il concetto di Essere nella filosofia di Heidegger?,approfondimento
Analizza in dettaglio filosofia.,approfondimento
Approfondisci il tema di Nietzsche.,approfondimento
Approfondisci la concezione della storia in Vico.,approfondimento
Sviluppa il concetto di Wittgenstein.,approfondimento
Approfondisci il tema di Locke.,approfondimento
Sviluppa il concetto di Hume.,approfondimento
Esamina criticamente Hegel.,approfondimento
Sviluppa il concetto di Aristotele.,approfondimento
Analizza in dettaglio Aristotele.,approfondimento
Approfondisci il tema di Marx.,approfondimento
Come si sviluppa la critica alla religione in Feuerbach e Marx?,approfondimento
Come si evolve il pensiero su Locke?,approfondimento
Esamina criticamente Marx.,approfondimento
Come si evolve il pensiero su Hegel?,approfondimento
Analizza in dettaglio Rousseau.,approfondimento
Come si sviluppa il pensiero politico di Marx dal giovane Marx al Capitale?,approfondimento
Sviluppa il concetto di Nietzsche.,approfondimento
Approfondisci il concetto di tempo in Agostino di Ippona.,approfondimento
Approfondisci il tema di Aristotele.,approfondimento
Approfondisci il concetto di intenzionalità in Brentano e Husserl.,approfondimento
Approfondisci il tema di Rousseau.,approfondimento
Sviluppa il concetto di Kant.,approfondimento
Come si sviluppa la teoria delle forme di governo in Aristotele?,approfondimento
Sviluppa il concetto di filosofia.,approfondimento
Come evolve il pensiero di Wittgenstein dal Tractatus alle Ricerche Filosofiche?,approfondimento
Come evolve la concezione della scienza in Popper?,approfondimento
Come si evolve il pensiero su Aristotele?,approfondimento
Come si evolve il pensiero su Platone?,approfondimento
Quali sono gli aspetti principali di Aristotele?,approfondimento
Approfondisci la teoria del linguaggio nel secondo Wittgenstein.,approfondimento
Quali sono gli aspetti principali di Nietzsche?,approfondimento
Esamina criticamente Platone.,approfondimento
Come si sviluppa la critica alla metafisica in Nietzsche?,approfondimento
Come si evolve il pensiero su Nietzsche?,approfondimento
Analizza in dettaglio Hume.,approfondimento
Approfondisci il concetto di phronesis in Aristotele.,approfondimento
Come si evolve il pensiero su Marx?,approfondimento
Analizza in dettaglio Hegel.,approfondimento
Approfondisci il tema della tolleranza in Locke e Mill.,approfondimento
Quali sono gli aspetti principali di Hegel?,approfondimento
Come si evolve il pensiero su Kant?,approfondimento
Quali sono gli aspetti principali di Kant?,approfondimento
"Come evolve la concezione dell'io in Locke, Hume e Kant?",approfondimento
Sviluppa il concetto di Platone.,approfondimento
Approfondisci il tema della morte nella filosofia epicurea.,approfondimento
Approfondisci il tema di Kant.,approfondimento
Approfondisci il concetto di intersoggettività in Husserl.,approfondimento
Come si evolve il pensiero su filosofia?,approfondimento
Approfondisci il tema dell'autenticità in Heidegger.,approfondimento
Sviluppa il concetto di Locke.,approfondimento
Che cos'è la fenomenologia secondo Husserl?,definizione
Che cosa si intende per 'Kant'?,definizione
Cos'è il dualismo cartesiano?,definizione
Come definiresti filosofia?,definizione
Definisci Kant.,definizione
What does 'cogito ergo sum'?,definizione
Che cosa si intende per 'Spinoza'?,definizione
Che cosa si intende per 'filosofia'?,definizione
Che cos'è l'empirismo?,definizione
Che cos'è il relativismo morale?,definizione
Cos'è Hegel?,definizione
Come definiresti Locke?,definizione
Cos'è lo stoicismo?,definizione
Come definiresti Aristotele?,definizione
Che cosa si intende per 'Dasein' in Heidegger?,definizione
Come definiresti Rousseau?,definizione
Che cosa si intende per 'virtù' in Aristotele?,definizione
Cos'è il determinismo filosofico?,definizione
Che cosa significa 'etica della virtù'?,definizione
Cos'è la dialettica hegeliana?,definizione
What does 'epoché' nella fenomenologia?,definizione
Spiega il concetto di Aristotele.,definizione
Che cosa si intende per 'essere in sé' in Sartre?,definizione
Cos'è il contratto sociale secondo Rousseau?,definizione
Che cosa si intende per 'Locke'?,definizione
What è la definizione di Locke?,definizione
What è la definizione di Platone?,definizione
Come definiresti il mito della caverna?,definizione
Cos'è la maieutica socratica?,definizione
Definisci Locke.,definizione
Cos'è Aristotele?,definizione
Cos'è l'utilitarismo secondo Mill?,definizione
Definisci Aristotele.,definizione
Cos'è la metafisica come disciplina filosofica?,definizione
Che cos'è l'idealismo trascendentale?,definizione
What è la definizione di Sartre?,definizione
Cos'è il pensiero critico secondo Kant?,definizione
Definisci Hegel.,definizione
Cos'è il pragmatismo filosofico?,definizione
What is meant by 'aporia' nel pensiero greco?,definizione
What è la definizione di Rousseau?,definizione
Che cos'è il pensiero di Spinoza sulla sostanza?,definizione
What is meant by 'giustizia' nella Repubblica di Platone?,definizione
Spiega il concetto di il mito della caverna.,definizione
Che cos'è il nichilismo?,definizione
Che cosa si intende per imperativo categorico in Kant?,definizione
What è la definizione di Nietzsche?,definizione
What is meant by 'essere per sé' in Sartre?,definizione
Che cosa si intende per 'volontà di potenza' in Nietzsche?,definizione
Cos'è Platone?,definizione
What is meant by 'mito della caverna'?,definizione
Cos'è Kant?,definizione
Spiega il concetto di Nietzsche.,definizione
What è la definizione di Marx?,definizione
Che cosa si intende per 'Nietzsche'?,definizione
Che cosa si intende per 'Aristotele'?,definizione
What is meant by 'tabula rasa' in Locke?,definizione
Cos'è Locke?,definizione
Definisci Rousseau.,definizione
What è la definizione di Aristotele?,definizione
What is meant by 'monade' in Leibniz?,definizione
What è la definizione di filosofia?,definizione
Che cosa si intende per 'Platone'?,definizione
Come definiresti Sartre?,definizione
Come definiresti Kant?,definizione
Cos'è il solipsismo?,definizione
Cos'è il razionalismo come corrente filosofica?,definizione
What is meant by 'mondo delle idee' in Platone?,definizione
What is meant by 'eterno ritorno' in Nietzsche?,definizione
Spiega il concetto di Spinoza.,definizione
Che cos'è la logica formale secondo Aristotele?,definizione
